<?xml version="1.0"?>
<!DOCTYPE signatures SYSTEM "file://localhost/System/Library/DTDs/BridgeSupport.dtd">
<signatures version="0.9">
  <ignored_headers>
    <header>QTCaptureLayer.h</header>
  </ignored_headers>
  <struct name="QTTime"/>
  <struct name="QTTimeRange"/>
  <function name="QTGetTimeInterval">
    <arg index="1" type_modifier="o"/>
  </function>
  <function name="QTGetTimeRecord">
    <arg index="1" type_modifier="o"/>
  </function>
  <class name="QTMedia">
    <method selector="initWithQuickTimeMedia:error:">
      <arg index="0" type_modifier="n"/>
      <arg index="1" type_modifier="o"/>
    </method>
    <method class_method="true" selector="mediaWithQuickTimeMedia:error:">
      <arg index="0" type_modifier="n"/>
      <arg index="1" type_modifier="o"/>
    </method>
  </class>
  <class name="QTMovie">
    <method selector="addChapters:withAttributes:error:">
      <arg index="2" type_modifier="o"/>
    </method>
    <method selector="frameImageAtTime:withAttributes:error:">
      <arg index="2" type_modifier="o"/>
    </method>
    <method selector="initToWritableData:error:">
      <arg index="1" type_modifier="o"/>
    </method>
    <method selector="initToWritableDataReference:error:">
      <arg index="1" type_modifier="o"/>
    </method>
    <method selector="initToWritableFile:error:">
      <arg index="1" type_modifier="o"/>
    </method>
    <method selector="initWithAttributes:error:">
      <arg index="1" type_modifier="o"/>
    </method>
    <method selector="initWithData:error:">
      <arg index="1" type_modifier="o"/>
    </method>
    <method selector="initWithDataReference:error:">
      <arg index="1" type_modifier="o"/>
    </method>
    <method selector="initWithFile:error:">
      <arg index="1" type_modifier="o"/>
    </method>
    <method selector="initWithMovie:timeRange:error:">
      <arg index="2" type_modifier="o"/>
    </method>
    <method selector="initWithPasteboard:error:">
      <arg index="1" type_modifier="o"/>
    </method>
    <method selector="initWithQuickTimeMovie:disposeWhenDone:error:">
      <arg index="0" type_modifier="n"/>
      <arg index="2" type_modifier="o"/>
    </method>
    <method selector="initWithURL:error:">
      <arg index="1" type_modifier="o"/>
    </method>
    <method class_method="true" selector="movieNamed:error:">
      <arg index="1" type_modifier="o"/>
    </method>
    <method class_method="true" selector="movieWithAttributes:error:">
      <arg index="1" type_modifier="o"/>
    </method>
    <method class_method="true" selector="movieWithData:error:">
      <arg index="1" type_modifier="o"/>
    </method>
    <method class_method="true" selector="movieWithDataReference:error:">
      <arg index="1" type_modifier="o"/>
    </method>
    <method class_method="true" selector="movieWithFile:error:">
      <arg index="1" type_modifier="o"/>
    </method>
    <method class_method="true" selector="movieWithPasteboard:error:">
      <arg index="1" type_modifier="o"/>
    </method>
    <method class_method="true" selector="movieWithQuickTimeMovie:disposeWhenDone:error:">
      <arg index="0" type_modifier="n"/>
      <arg index="2" type_modifier="o"/>
    </method>
    <method selector="movieWithTimeRange:error:">
      <arg index="1" type_modifier="o"/>
    </method>
    <method class_method="true" selector="movieWithURL:error:">
      <arg index="1" type_modifier="o"/>
    </method>
    <method selector="writeToFile:withAttributes:error:">
      <arg index="2" type_modifier="o"/>
    </method>
  </class>
  <class name="QTTrack">
    <method selector="initWithQuickTimeTrack:error:">
      <arg index="0" type_modifier="n"/>
      <arg index="1" type_modifier="o"/>
    </method>
    <method class_method="true" selector="trackWithQuickTimeTrack:error:">
      <arg index="0" type_modifier="n"/>
      <arg index="1" type_modifier="o"/>
    </method>
  </class>
  <class name="QTDataReference">
    <method class_method="true" selector="dataReferenceWithDataRef:type:">
      <arg index="0" type_modifier="n"/>
    </method>
    <method selector="initWithDataRef:type:">
      <arg index="0" type_modifier="n"/>
    </method>
    <method selector="setDataRef:">
      <arg index="0" type_modifier="n"/>
    </method>
  </class>
</signatures>
