<?xml version="1.0"?>
<!DOCTYPE signatures SYSTEM "file://localhost/System/Library/DTDs/BridgeSupport.dtd">
<signatures version="0.9">
  <struct name="NPByteRange"/>
  <struct name="NPClass"/>
  <struct name="NPEmbedPrint"/>
  <struct name="NPFullPrint"/>
  <struct name="NPNetscapeFuncs"/>
  <struct name="NPObject"/>
  <struct name="NPP_t"/>
  <struct name="NPPluginFuncs"/>
  <struct name="NPPrint"/>
  <struct name="NPRect"/>
  <struct name="NPSavedData"/>
  <struct name="NPStream"/>
  <struct name="NPString"/>
  <struct name="NPVariant"/>
  <struct name="NPWindow"/>
  <struct name="NP_Port" only_in="32"/>
  <function name="HIWebViewCreate">
    <arg index="0" type_modifier="n"/>
  </function>
  <function name="NPN_CreateObject">
    <arg index="0" type_modifier="n"/>
    <arg index="1" type_modifier="n"/>
  </function>
  <function name="NPN_DestroyStream">
    <arg index="0" type_modifier="n"/>
    <arg index="1" type_modifier="n"/>
  </function>
  <function name="NPN_Evaluate">
    <arg index="0" type_modifier="n"/>
    <arg index="1" type_modifier="n"/>
    <arg index="2" type_modifier="n"/>
    <arg index="3" type_modifier="o"/>
  </function>
  <function name="NPN_GetProperty">
    <arg index="0" type_modifier="n"/>
    <arg index="1" type_modifier="n"/>
    <arg index="2" type_modifier="n"/>
    <arg index="3" type_modifier="o"/>
  </function>
  <function name="NPN_GetStringIdentifiers">
    <arg c_array_length_in_arg="1" index="0" type_modifier="n"/>
    <arg c_array_length_in_arg="1" index="2" type_modifier="o"/>
  </function>
  <function name="NPN_GetURLNotify">
    <arg index="0" type_modifier="n"/>
    <arg index="3" type_modifier="n"/>
  </function>
  <function name="NPN_GetValue">
    <arg index="0" type_modifier="n"/>
    <arg index="2" type_modifier="o"/>
  </function>
  <function name="NPN_HasMethod">
    <arg index="0" type_modifier="n"/>
    <arg index="1" type_modifier="n"/>
    <arg index="2" type_modifier="n"/>
  </function>
  <function name="NPN_HasProperty">
    <arg index="0" type_modifier="n"/>
    <arg index="1" type_modifier="n"/>
    <arg index="2" type_modifier="n"/>
  </function>
  <function name="NPN_InvalidateRect">
    <arg index="0" type_modifier="n"/>
    <arg index="1" type_modifier="n"/>
  </function>
  <function name="NPN_Invoke">
    <arg index="0" type_modifier="n"/>
    <arg index="1" type_modifier="n"/>
    <arg index="2" type_modifier="n"/>
    <arg c_array_length_in_arg="4" index="3" type_modifier="n"/>
    <arg index="5" type_modifier="o"/>
  </function>
  <function name="NPN_InvokeDefault">
    <arg index="0" type_modifier="n"/>
    <arg index="1" type_modifier="n"/>
    <arg c_array_length_in_arg="3" index="2" type_modifier="n"/>
    <arg index="4" type_modifier="o"/>
  </function>
  <function name="NPN_MemFree">
    <arg index="0" type_modifier="n"/>
  </function>
  <function name="NPN_NewStream">
    <arg index="0" type_modifier="n"/>
    <arg index="3" type_modifier="o"/>
  </function>
  <function name="NPN_PostURLNotify">
    <arg index="0" type_modifier="n"/>
    <arg index="6" type_modifier="n"/>
  </function>
  <function name="NPN_ReleaseObject">
    <arg index="0" type_modifier="n"/>
  </function>
  <function name="NPN_ReleaseVariantValue">
    <arg index="0" type_modifier="n"/>
  </function>
  <function name="NPN_RemoveProperty">
    <arg index="0" type_modifier="n"/>
    <arg index="1" type_modifier="n"/>
    <arg index="2" type_modifier="n"/>
  </function>
  <function name="NPN_RequestRead">
    <arg index="0" type_modifier="n"/>
    <arg index="1" type_modifier="n"/>
  </function>
  <function name="NPN_RetainObject">
    <arg index="0" type_modifier="n"/>
  </function>
  <function name="NPN_SetException">
    <arg index="0" type_modifier="n"/>
  </function>
  <function name="NPN_SetProperty">
    <arg index="0" type_modifier="n"/>
    <arg index="1" type_modifier="n"/>
    <arg index="2" type_modifier="n"/>
    <arg index="3" type_modifier="n"/>
  </function>
  <function name="NPN_SetValue">
    <arg index="0" type_modifier="n"/>
    <arg index="2" type_modifier="n"/>
  </function>
  <function name="NPN_Version">
    <arg index="0" type_modifier="o"/>
    <arg index="1" type_modifier="o"/>
    <arg index="2" type_modifier="o"/>
    <arg index="3" type_modifier="o"/>
  </function>
  <function name="NPN_Write">
    <arg index="0" type_modifier="n"/>
    <arg index="1" type_modifier="n"/>
    <arg c_array_length_in_arg="2" index="3" type_modifier="n"/>
  </function>
  <function name="NPP_DestroyStream">
    <arg index="0" type_modifier="n"/>
    <arg index="1" type_modifier="n"/>
  </function>
  <function name="NPP_GetValue">
    <arg index="0" type_modifier="n"/>
    <arg index="2" type_modifier="o"/>
  </function>
  <function name="NPP_HandleEvent">
    <arg index="0" type_modifier="n"/>
    <arg index="1" type_modifier="n"/>
  </function>
  <function name="NPP_New">
    <arg index="1" type_modifier="n"/>
    <arg c_array_length_in_arg="3" index="4" type_modifier="n"/>
    <arg c_array_length_in_arg="3" index="5" type_modifier="n"/>
    <arg index="6" type_modifier="n"/>
  </function>
  <function name="NPP_NewStream">
    <arg index="0" type_modifier="n"/>
    <arg index="2" type_modifier="n"/>
    <arg index="4" type_modifier="N"/>
  </function>
  <function name="NPP_Print">
    <arg index="0" type_modifier="n"/>
    <arg index="1" type_modifier="o"/>
  </function>
  <function name="NPP_SetValue">
    <arg index="0" type_modifier="n"/>
    <arg index="2" type_modifier="n"/>
  </function>
  <function name="NPP_SetWindow">
    <arg index="0" type_modifier="n"/>
    <arg index="1" type_modifier="n"/>
  </function>
  <function name="NPP_StreamAsFile">
    <arg index="0" type_modifier="n"/>
    <arg index="1" type_modifier="o"/>
  </function>
  <function name="NPP_URLNotify">
    <arg index="0" type_modifier="n"/>
    <arg index="3" type_modifier="n"/>
  </function>
  <function name="NPP_Write">
    <arg index="0" type_modifier="n"/>
    <arg index="1" type_modifier="n"/>
    <arg c_array_of_fixed_length="3" index="4" type_modifier="n"/>
  </function>
  <function name="NPP_WriteReady">
    <arg index="0" type_modifier="n"/>
    <arg index="1" type_modifier="n"/>
  </function>
  <function name="NPN_ForceRedraw">
    <arg index="0" type_modifier="n"/>
  </function>
  <function name="NPN_GetJavaPeer">
    <arg index="0" type_modifier="n"/>
  </function>
  <function name="NPN_GetURL">
    <arg index="0" type_modifier="n"/>
  </function>
  <function name="NPN_IdentifierIsString">
    <arg index="0" type_modifier="n"/>
  </function>
  <function name="NPN_IntFromIdentifier">
    <arg index="0" type_modifier="n"/>
  </function>
  <function name="NPN_InvalidateRegion">
    <arg index="0" type_modifier="n"/>
    <arg index="1" type_modifier="n"/>
  </function>
  <function name="NPN_PostURL">
    <arg index="0" type_modifier="n"/>
  </function>
  <function name="NPN_Status">
    <arg index="0" type_modifier="n"/>
  </function>
  <function name="NPN_UTF8FromIdentifier">
    <arg index="0" type_modifier="n"/>
  </function>
  <function name="NPN_UserAgent">
    <arg index="0" type_modifier="n"/>
  </function>
  <function name="NPP_Destroy">
    <arg index="0" type_modifier="n"/>
    <arg index="1" type_modifier="o"/>
  </function>
  <class name="NSObject">
    <method selector="webPlugInCallJava:isStatic:returnType:method:arguments:callingURL:exceptionDescription:">
      <arg index="0" type_modifier="n"/>
      <arg index="3" type_modifier="n"/>
      <arg index="4" c_array_of_variable_length="true" type_modifier="n"/>
      <arg index="6" type_modifier="o"/>
    </method>
  </class>
  <class name="WebHistory">
    <method selector="loadFromURL:error:">
      <arg index="1" type_modifier="o"/>
    </method>
    <method selector="saveToURL:error:">
      <arg index="1" type_modifier="o"/>
    </method>
  </class>
</signatures>
