<?xml version="1.0"?>
<!DOCTYPE signatures SYSTEM "file://localhost/System/Library/DTDs/BridgeSupport.dtd">
<signatures version="0.9">
  <class name="NSManagedObject">
    <method selector="setObservationInfo:">
      <arg index="0" type_modifier="n"/>
    </method>
    <method selector="validateForDelete:">
      <arg index="0" type_modifier="o"/>
    </method>
    <method selector="validateForInsert:">
      <arg index="0" type_modifier="o"/>
    </method>
    <method selector="validateForUpdate:">
      <arg index="0" type_modifier="o"/>
    </method>
    <method selector="validateValue:forKey:error:">
      <arg index="0" type_modifier="o"/>
      <arg index="2" type_modifier="o"/>
    </method>
  </class>
  <class name="NSManagedObjectContext">
    <method selector="countForFetchRequest:error:">
      <arg index="1" type_modifier="o"/>
    </method>
    <method selector="executeFetchRequest:error:">
      <arg index="1" type_modifier="o"/>
    </method>
    <method selector="observeValueForKeyPath:ofObject:change:context:">
      <arg index="3" type_modifier="n"/>
    </method>
    <method selector="obtainPermanentIDsForObjects:error:">
      <arg index="1" type_modifier="o"/>
    </method>
    <method selector="save:">
      <arg index="0" type_modifier="o"/>
    </method>
  </class>
  <class name="NSPersistentStoreCoordinator">
    <method selector="addPersistentStoreWithType:configuration:URL:options:error:">
      <arg index="4" type_modifier="o"/>
    </method>
    <method class_method="true" selector="metadataForPersistentStoreOfType:URL:error:">
      <arg index="2" type_modifier="o"/>
    </method>
    <method class_method="true" selector="metadataForPersistentStoreWithURL:error:">
      <arg index="1" type_modifier="o"/>
    </method>
    <method selector="migratePersistentStore:toURL:options:withType:error:">
      <arg index="4" type_modifier="o"/>
    </method>
    <method selector="removePersistentStore:error:">
      <arg index="1" type_modifier="o"/>
    </method>
    <method class_method="true" selector="setMetadata:forPersistentStoreOfType:URL:error:">
      <arg index="3" type_modifier="o"/>
    </method>
  </class>
</signatures>
